state,state_abbrev,bill,sponsors,party,status,key_provisions,activity_level
Maine,ME,"LD 307 / HP 207, 132nd Legislature",Rep. Melanie Sachs; original bill page also identifies Rep. Drew Gattine on adopted amendment H-1051,Democratic,"Passed Legislature; vetoed by Gov. Janet Mills 2026-04-24; veto sustained 2026-04-29 (per Maine Legislature bill status page, final disposition ""Veto Sustained, Apr 29, 2026"")","Would have prohibited any municipality, state agency, or quasi-independent state entity from accepting applications or issuing permits, certificates, or approvals for development, construction, or operation of a data center with a load of 20 MW or more until 2027-11-01. Would have created the Maine Data Center Coordination Council to study ratepayer, grid reliability, environmental, host-community, data-sharing, impact fee, demand response, and community benefit agreement issues, with report due 2027-02-01.",Medium
Maine,ME,"LD 713 / HP 452, 132nd Legislature; Public Law 2026, c. 768",Rep. Daniel Sayre,Democratic,Enacted; signed 2026-04-23,"Excludes data centers beginning operations on or after 2026-08-01 from the Business Equipment Tax Exemption and Dirigo Business Incentives Program. Defines ""data center"" in Title 36 and requires the Department of Economic and Community Development to study financial incentives that data centers may benefit from, with report due 2026-11-04.",Medium
Maine,ME,"LD 912 / SP 402, 132nd Legislature; Public Law 2025, c. 85",Sen. Glenn Curry,D (ME Senate Democrat),Enacted; signed 2025-05-23,Amended Title 35-A definition of transmission and distribution utility. A private-distribution exception for a northern Maine commercial or industrial site does not apply if more than 25% of the entity's nameplate capacity serves data centers on that site.,Medium
Maine,ME,"LD 1722 / HP 1202, 128th Legislature",Rep. Stephen Stanley,"D (ME House Democrat, Medway)","Dead; ONTP, 2018-03-22",Proposed sales tax refund/exemption structure for computer data center development; not a moratorium.,Medium
Maine,ME,"LD 1259 / SP 380, 125th Legislature",Sen. Roger Sherman,"R (ME Senate Republican, Aroostook)","Dead; ONTP, 2011-05-17",Proposed to encourage computer data center development; not a moratorium.,Medium
Maine,ME,"LD 192 / HP 169, 125th Legislature",Rep. Cynthia Dill,"D (ME House Democrat, then-Cape Elizabeth)","Dead; ONTP, 2011-03-15","Proposed to bring a ""green data center"" to Maine; not a moratorium.",Medium
Maryland,MD,HB0120 (2026),Del. Fisher et al.,R primary,Hearing held in House Environment and Transportation,"Statewide moratorium on construction and government approval of new data centers; would terminate if co-location legislation for data centers and gas, nuclear, or small modular reactor generation is enacted.",Medium
Maryland,MD,HB0293 / SB0056 (2026),"House Ways and Means Committee; Senate Education, Energy, and the Environment Committee",Committee bills,"Approved by Governor, Chapters 100 and 101",Authorizes Maryland Longitudinal Data System Center external data sharing with third-party data centers for multistate reporting; not a siting moratorium.,Medium
Maryland,MD,HB0560 (2026),Del. Palakovich Carr et al.,D primary,Hearing held in House Ways and Means,Repeals sales and use tax exemption for qualified data center personal property and local authority to reduce or eliminate assessment of qualified data center personal property.,Medium
Maryland,MD,HB0799 (2026),Del. Miller,R,Hearing held in House Environment and Transportation,Maryland Co-Location Energy Innovation and Reliability Act; data center/generation co-location framework.,Medium
Maryland,MD,HB0940 / SB0596 (2026),Del. Charkoudian; Sen. Hester,D / D,Hearings held,Large load customer interconnection and demand response program; would create interconnection process and prioritization provisions for certain large loads.,Medium
Maryland,MD,HB1082 (2026),Del. R. Long,R,Hearing held in House Environment and Transportation [status from subject index],Applies large load customer rate schedule requirements to certain data centers and moves utility filing deadline to 2027-01-01.,Medium
Maryland,MD,HB1411 (2026),Del. Ruth,D,Hearing held in House Environment and Transportation [status from subject index],"Requires large-scale data center disclosure reports and requires local jurisdictions with at least 10,000 residents to adopt local large-scale data center plans by 2027-06-30.",Medium
Maryland,MD,HB1532 / SB0841 (2026),Speaker Pena-Melnyk; Sen. Feldman,D / D,HB1532 passed enrolled / to Governor; SB0841 favorable with amendments,"Utility RELIEF Act. Establishes large load customer registry, voluntary clean capacity rating program, interconnection process, and Baltimore City data center limits in certain development districts.",Medium
Maryland,MD,HB1534 (2026),Del. Miller,R,Hearing held in House Environment and Transportation [status from subject index],"Requires data center standards, MDE sound/vibration and backup generation rules, agricultural land siting limits, and applicant reports.",Medium
Maryland,MD,HB1595 / SB0427 (2026),Del. Hornberger; Sen. Lewis Young,R / D,HB first reading House Rules; SB hearing held,Allows Baltimore City and counties to create a special personal property tax subclass and rate for qualified data centers.,Medium
Maryland,MD,SB0853 (2026),Sen. Sydnor,D,"Hearing held in Senate Education, Energy, and the Environment",Regulates nondisclosure agreements in economic development activity; relevant to data center transparency debates.,Medium
Maryland,MD,SB0992 (2026),Sen. Hester,D,"Hearing held in Senate Education, Energy, and the Environment","Public Utilities - Large Load Customers - Registration and Demand Response Program; registration, information disclosure, demand response, cost allocation, and data center incentive conditions.",Medium
Maryland,MD,SB1000 (2026),Sen. Ferguson,D,First reading Senate Rules,Expands transmission-line requirements and prohibits construction of data centers in certain Baltimore City development districts.,Medium
Massachusetts,MA,H.83 (194th),"Rep. Bradley H. Jones, Jr.; cosponsors Kimberly N. Ferguson, Paul K. Frost, Todd M. Smola, Kelly W. Pease",R-led,Referred to House Rules; current page shows House Rules status after 2026-01-08 discharge,"Creates a special legislative commission to study load growth due to AI and data centers, including high-performance computing and electrification demand.",Medium
Massachusetts,MA,HD.5404 (194th),Rep. Rodney M. Elliott; Rep. Tara T. Hong added as petitioner,D,Referred to House Rules on 2025-12-11,Would add G.L. c. 164 Section 152 to prevent residential and income-eligible customers from bearing increased electric costs caused by large or qualified data centers; covered facilities include sites able to use 10 MW or more.,Medium
Massachusetts,MA,H.4144 (194th),Gov. Maura T. Healey,D,"Accompanied a study order, H.5324, on 2026-04-06","Broad energy affordability and grid bill; not a data center moratorium bill, but addresses load growth, grid planning, and utility infrastructure cost allocation.",Medium
Massachusetts,MA,S.37 -> S.2630 (194th),"Sen. Barry R. Finegold; reported by Joint Committee on Advanced Information Technology, the Internet and Cybersecurity",D; committee bill,S.2630 referred to Senate Ways and Means on 2025-10-16,AI economic development and safety bill with compute-related provisions; not a data center moratorium bill.,Medium
Massachusetts,MA,Chapter 238 of the Acts of 2024 / G.L. c. 64H Section 6(zz),Conference legislation,N/A,Enacted 2024,"Creates sales/use tax exemption for qualified data center equipment, software, electricity, and construction costs; 20-year qualification period; 100,000-square-foot and $50 million thresholds.",Medium
Michigan,MI,HB 5594 (2026),"Rep. Jennifer Wortz; cosponsors include Reps. Paquette, Fox, Miller, Wegela, Foreman, DeSana, Smit, Schriver, Byrnes, and Rigas",R lead; bipartisan cosponsors,Introduced 2026-02-26; House Government Operations Committee,"Creates the Data Center Regulation Act; bars local units and EGLE from issuing approvals for data centers and bars new operations until 2027-04-01; civil fine up to $1,000 per day for operating violations.",High
Michigan,MI,HB 5595 (2026),"Rep. Dylan Wegela; cosponsors include Reps. Wortz, Paquette, Fox, Foreman, Miller, DeSana, Smit, Byrnes, and Schriver",D lead; bipartisan cosponsors,Introduced 2026-02-26; House Government Operations Committee,"Bars MPSC approval of any electric-utility contract, tariff, discount, or rate with a qualified data center until 2027-04-01.",High
Michigan,MI,HB 5596 (2026),"Rep. Joseph Fox; cosponsors include Reps. Wortz, Wegela, Byrnes, Paquette, Foreman, DeSana, Smit, and Schriver",R lead; bipartisan cosponsors,Introduced 2026-02-26; House Government Operations Committee,Tie-bar amendment to the Michigan Zoning Enabling Act referencing the Data Center Regulation Act.,High
Michigan,MI,HB 5881 (2026),"Reps. Reggie Miller, Dievendorf, and Paiz",D (all three; Reggie Miller and Emily Dievendorf both list profiles on housedems.com; Paiz does not appear on the Michigan House Republican caucus roster at gophouse.org/members),Introduced 2026-04-23; House Government Operations Committee,Tie-bar amendment to the Michigan Zoning Enabling Act adding reference to the Data Center Planning and Responsibility Act.,High
Michigan,MI,HB 5882 (2026),"Reps. Reggie Miller, Dievendorf, and Paiz",D (all three; see HB 5881 row),Introduced 2026-04-23; House Government Operations Committee,"Regulates local moratoria on large-scale data centers and cryptocurrency mining facilities; requires ordinance or resolution at a public meeting, public-interest findings, hardship appeal, NDA prohibition, 6-month initial cap, one 90-day extension cap, final hearing, and MPSC thresholds for large-scale classification.",High
Michigan,MI,HB 5396 (2025),Rep. Dylan Wegela,D,Introduced 2025-12-17; House Economic Competitiveness Committee,Repeals sales-tax data-center exemption in MCL 205.54ee.,High
Michigan,MI,HB 5397 (2025),Rep. James DeSana,R,Introduced 2025-12-17; House Economic Competitiveness Committee,Repeals use-tax data-center exemption in MCL 205.94cc.,High
Michigan,MI,HB 5398 (2025),Rep. Erin Byrnes,D,Introduced 2025-12-17; House Economic Competitiveness Committee,Conforming property-tax change tied to repeal package.,High
Michigan,MI,HB 5399 (2025),Rep. Reggie Miller,D,Introduced 2025-12-18; House Economic Competitiveness Committee,Would prohibit local officials from signing NDAs related to data-center construction.,High
Michigan,MI,SB 761 (2025),Sen. Rosemary Bayer,D,Introduced 2025-12-18; Senate Energy and Environment Committee,"Prohibits water withdrawal permits for users averaging over 2,000,000 gallons/day for consumptive use.",High
Michigan,MI,SB 762 (2025),Sen. Sue Shink,D,Introduced 2025-12-18; Senate Energy and Environment Committee,Requires data-center energy and water usage reporting through amendment to MCL 460.5a.,High
Michigan,MI,SB 763 (2025),Sen. Erika Geiss,D,Introduced 2025-12-18; Senate Energy and Environment Committee,Bars water utilities from passing data center infrastructure costs onto residential customers.,High
Michigan,MI,HB 4906 (2023),Rep. Joey Andrews,D,Enacted as 2024 PA 207,Expanded sales-tax exemption framework for enterprise data centers.,High
Michigan,MI,2024 PA 181,Legislature; use-tax incentive act,Mixed,Enacted 2024,Created or expanded qualified and enterprise data center use-tax exemptions through 2050 if conditions are met.,High
Minnesota,MN,2025 1st Special Session HF 16 / Chapter 12,Rep. Greg Davids; Rep. Jon Huot; Sen. Ann H. Rest,R; DFL; DFL,Enacted 2025-06-14,"Created a statewide data-center regulatory package. Key provisions include water preapplication review for data centers proposing more than 100,000,000 gallons per year of consumptive use, permit conditions for large water appropriation projects, utility tariff provisions for very large customers, an annual qualified large-scale data center fee based on peak MW, and modified sales and use tax exemptions.",Medium
Minnesota,MN,SF 608 / HF 1109 (2025),"Sen. Bill Lieske, Sen. Erin Maye Quade, Sen. Nathan Wesenberg, Sen. Glenn Gruenhagen, Sen. Jen McEwen; House companion by Rep. Drew Roach","Mixed R (Lieske, Wesenberg, Gruenhagen, Roach) and DFL (Maye Quade, McEwen) [VERIFY: full House author list for HF 1109 not separately confirmed beyond Roach]",SF 608 introduced 2025-01-27 and referred to Senate State and Local Government; not enacted as standalone bill,Would prohibit enterprise data centers in nonindustrial districts and allow them by conditional use in industrial districts.,Medium
Minnesota,MN,SF 3968 / HF 2928 (2026),"Sen. Jen McEwen, Sen. Ann Johnson Stewart, Sen. Erin Maye Quade",DFL (all three are MN Senate DFL caucus),"Introduced 2026-02-26; referred to Senate Energy, Utilities, Environment, and Climate","Broad data center regulation bill. Revisor text includes environmental review requirements for 100 MW+ data centers or expansions, carbon-free energy procurement requirements, utility and energy facility provisions, and fee/account changes.",Medium
Minnesota,MN,HF 3793 (2026),Sponsor list not parsed from captured Revisor page (Authors section was empty in captured snapshot) [VERIFY: HF 3793 author list not extracted from captured Revisor page; page renders authors via JavaScript and was not captured],[VERIFY],Introduced 2026-02-26; later House actions through 2026-03-12,Would require certain users of large amounts of groundwater to apply for their own water-use permit instead of modifying an existing municipal permit. Data centers are one target use in captured hearing testimony and bill text.,Medium
Minnesota,MN,HF 4077 (2026),Sponsor list not parsed from captured Revisor page [VERIFY: HF 4077 author list not extracted from captured Revisor page],[VERIFY],Introduced 2026-03-09; House actions through 2026-03-25,Would prohibit municipalities from entering nondisclosure agreements or contracts that restrict municipal disclosure of information about projects using public funding; state testimony connects the bill to data center secrecy disputes.,Medium
Minnesota,MN,SF 4298 / HF 4888 (2026),"SF: Sen. Jen McEwen, Sen. Erin Maye Quade, Sen. Lindsey Port, Sen. John Marty, Sen. A. Erin Clark; HF: Rep. Leigh Finke, Rep. Alicia Kozlowski, Rep. Tou Xiong, Rep. Brion Curran, Rep. Tuldok T. Buck","DFL (all listed Senate authors are DFL; House authors are DFL based on House Majority Caucus rosters; ""Buck"" is Tuldok T. Buck, DFL)","SF introduced 2026-03-09 and referred to Senate Energy, Utilities, Environment, and Climate; HF introduced 2026-04-09 and referred to House Energy Finance and Policy","Would impose a state and local permitting moratorium for data centers until one calendar year after the Public Utilities Commission submits a comprehensive data center report, due by 2027-07-01 with possible extension to 2028-01-01. Report topics include energy, water, metals, localized impacts, listed species, Tribal treaty rights, economic impacts, suitable locations, and public comment.",Medium
Minnesota,MN,SF 4296 / HF 4512 (2026),"Sen. Erin Maye Quade, Sen. Tou Xiong, Sen. Jim Abeler, Sen. Ann Johnson Stewart, Sen. Jen McEwen",Mixed DFL and R,SF introduced 2026-03-09; referred to Senate State and Local Government; committee report to pass as amended and second reading on 2026-03-18,Would require public hearings and disclosures before local approval of data center development.,Medium
Minnesota,MN,SF 4816 (2026),Sen. Mary Kunesh,DFL,"Introduced 2026-03-25 and referred to Senate Environment, Climate, and Legacy",Would require Environmental Quality Board rulemaking to make construction of a data center subject to mandatory environmental impact statement preparation.,Medium
Minnesota,MN,HF 4814 / SF 4548 (2026),"Rep. Jon Huot (DFL), Rep. Natalie Zeleznikar (R), Rep. Kari Rehrauer (DFL); Senate companion authors not confirmed in captured records [VERIFY: SF 4548 author list not extracted from captured Revisor page]",Mixed DFL and R,HF introduced 2026-04-07 and referred to House Elections Finance and Government Operations,Would bar local elected officials from entering nondisclosure agreements or similar contracts restricting public disclosure of information about potential data center development.,Medium
Minnesota,MN,SF 4203 (2026),Author list not parsed from captured Revisor page [VERIFY: SF 4203 author list not extracted from captured Revisor page],[VERIFY],Introduced 2026-03; pending Revisor capture refresh,Would modify sales and use tax exemptions for data centers.,Medium
Minnesota,MN,SF 5100 (2026),Author list not parsed from captured Revisor page [VERIFY: SF 5100 author list not extracted from captured Revisor page],[VERIFY],Introduced 2026-04; pending Revisor capture refresh,"Would modify water preapplication evaluation criteria, solar standard treatment, qualified large-scale data center fees, electricity tax treatment, and energy generation redundancy provisions.",Medium
Minnesota,MN,SF 5231 (2026),Author list not parsed from captured Revisor page [VERIFY: SF 5231 author list not extracted from captured Revisor page],[VERIFY],Introduced 2026-04-24; pending Revisor capture refresh,Would repeal the data center tax exemption and repeal a contingent reduction in special education aid appropriations.,Medium
Mississippi,MS,SB3410 (2026),Sen. Josh Harkins,Republican,Approved by Governor on 2026-04-08,"Authorizes Brandon and the West Rankin Utility Authority to enter agreements with data center or related technology facility developers/operators for water and wastewater infrastructure, reclaimed water delivery, wastewater treatment, capacity guarantees, assignment rights, rates, and terms up to 30 years with renewal options.",Low
Mississippi,MS,HB1393 (2026),Reps. Brent Powell and Jeff Hale,Republican,Approved by Governor on 2026-04-08,"Creates the Mississippi Energy Infrastructure Fund. The definition of ""project"" includes data centers, making data-center-serving energy infrastructure potentially eligible for grants, loans, or other assistance through MDA, while excluding electric utilities as direct recipients.",Low
Mississippi,MS,HB4045 (2026),Rep. Trey Lamar,Republican,Died on Calendar on 2026-02-25,Would end certain income tax exemptions for income from qualifying data center projects after calendar year 2026 and create the Mississippi Strategic Development Fund funded partly through fee-in-lieu payments for projects over $2 billion.,Low
Mississippi,MS,HB4010 (2026),Rep. Ronnie Crudup Jr.,Democratic,Died in Committee on 2026-02-25,"Would revise the MFLEX framework and include a certified ""new data center enterprise"" or expansion as a qualifying enterprise category.",Low
Mississippi,MS,SB3106 (2024),Sen. Josh Harkins,Republican,"Dead; passed Senate, died in House Ways and Means on 2024-04-16","Would amend data center tax exemption provisions in Miss. Code Sections 57-113-21, 57-113-23, and 57-113-25, including definitions, application contents, and cure periods before forfeiture.",Low
Mississippi,MS,HB1239 (2025),Rep. Trey Lamar,Republican,Dead; died in conference on 2025-03-29,"Would revise data center enterprise definitions and state tax exemption terms in Sections 57-113-21, 57-113-23, and 57-113-25.",Low
Mississippi,MS,SB3168 (2025),Sen. Josh Harkins,Republican,"Dead; passed Senate, died in House committee on 2025-03-18",Would revise data center exemption definitions and create up to two additional 10-year exemption extensions for qualifying data center additions or expansions.,Low
Missouri,MO,HB 2239 (2026),Rep. Marty Joe Murray,Democrat,Filed; House bill page showed early-stage progress only; bill text introduced.,"Artificial Intelligence Data Center Environmental Accountability Act. Applies to AI-optimized data centers with 100 MW or greater IT load and major expansions; requires closed-loop or equivalent cooling, annual environmental and health reports, water and air monitoring, public health complaint reporting, and penalties.",Medium
Missouri,MO,HB 3362 (2026),Rep. Colin Wellenkamp,Republican,"Public Hearing Completed, 2026-03-30.","Creates new provisions for industrial utility users. Press release describes the bill as requiring large-load electricity consumers, including data centers, to pay costs for grid expansions, new generating capacity, or infrastructure upgrades; also creates water-resource protections.",Medium
Missouri,MO,HB 3364 (2026),Rep. Mike Costlow,Republican,"Public Hearing Completed, 2026-03-30.",Companion or related industrial utility user bill with major industrial water-user permit language.,Medium
Missouri,MO,HB 3369 (2026),Rep. Marty Joe Murray,Democrat,"Read Second Time, 2026-02-23; no hearing scheduled in captured bill page.","One-year St. Louis data center permitting pause. Would pause acceptance, processing, or approval of applications allowing creation or expansion of data centers until 2027-08-28 in a city not within a county; applications submitted before 2026-08-28 would be exempt.",Medium
Missouri,MO,HB 3390 (2026),Rep. Scott Cupps,Republican,"Read Second Time, 2026-02-25; no hearing scheduled in captured bill page.","Creates hyperscale data center siting restrictions. Defines hyperscale at 25 MW or more; prohibits hyperscale data centers in specified land use categories and agricultural zoning in unincorporated areas; adds 500-foot setback/native planting barrier, noise-control, local approval, ratepayer cost-shift, incentive affidavit, and major industrial water-user permit provisions.",Medium
Missouri,MO,SB 4 (2025),Sen. Mike Cierpiot,Republican,Enacted; approved by Governor 2025-04-09; effective 2025-08-28.,"Utility law requiring large-load tariff filings. Missouri PSC later approved Ameren Missouri's large-load plan for customers needing 75 MW or more of monthly peak demand, including data centers, with customer-protection terms.",Medium
Montana,MT,SB212 / LC0292,Sen. Daniel Zolnikov,R,Enacted; signed 2025-04-16; Chapter 150 assigned 2025-04-17,"""Right to Compute Act."" Creates a right to use computational resources and requires risk-management policies for critical infrastructure controlled by artificial intelligence systems. It expressly preserves government action to prevent or abate common-law nuisances from physical datacenter infrastructure. Not a moratorium bill.",None
Montana,MT,HB263 / LC0636,Rep. Katie Sullivan,D,Failed; tabled in House committee 2025-02-03; died in process 2025-05-20,Would have revised digital asset mining and data center ratemaking laws. Captured bill-status records identify the proposal as data center electricity reporting and ratemaking legislation; not a moratorium bill.,None
Montana,MT,HB424 / LC3009,Rep. Katie Zolnikov,R,Enacted; signed 2025-05-13; Chapter 678 assigned 2025-05-19,"Revises Class 17 data center property treatment. Keeps Class 17 property at a 0.9% taxable valuation rate, extends qualifying construction windows, includes dedicated communications infrastructure and certain onsite generation/storage, requires school equalization mills in TIF districts, and limits sales of power produced by a qualified data center to utilities or cooperatives to cost of production.",None
Montana,MT,SB540 / LC0982,Sen. Becky Beard,R,Failed; died in process 2025-05-23,"Proposed revisions to Class 17 property taxation. Passed the Senate and was amended in the House process, but did not become law.",None
Montana,MT,HB877 / LC2604,Rep. John Fitzpatrick,R,Failed; tabled in House committee 2025-03-31; taken from table 2025-04-04; missed appropriation transmittal deadline 2025-04-09; died in process 2025-05-20,"""Montana Data Center Development Act."" Would have limited PSC authority to prohibit service to large electric customers, including data centers, if the customer could show no adverse impact on existing utility customers. Critics described it as reducing PSC oversight. Not a moratorium bill.",None
Montana,MT,HJ46 / LC0933,Rep. Tom Millett,R,Failed; passed House; tabled in Senate committee 2025-04-24; died in standing committee 2025-05-22,"Would have requested an interim study of data center impacts on grid adequacy, electric rates, stranded utility investment, water demand, affordability, and regulatory safeguards. Not a moratorium bill.",None
Nebraska,NE,LB1010 (2026),Sen. Tom Brandt,Nonpartisan unicameral,Enacted; approved by Governor 2026-04-14,"Adopted the Large Load Customer Regulation Act and changed cryptocurrency mining and data center provisions. Requires large-load interconnection standards, study fees, cost allocation to large-load customers, curtailment procedures, annual data center reports on electricity demand, water use, incentives, energy measures, renewable commitments, and service life, plus decommissioning-cost responsibility and community benefit agreements for data centers.",Medium
Nebraska,NE,LB1261 (2026),"Sen. Barry DeKay, at the request of the Governor; Holdcroft; F. Meyer",Nonpartisan unicameral,Enacted; approved by Governor 2026-04-14,"Bars consumer-owned utilities from using eminent domain to acquire qualifying privately owned generation facilities serving a single industrial customer with new load over 1,000 MW, if PRB approval, utility contracts, cost-payment, and use restrictions are satisfied.",Medium
Nebraska,NE,LB1064 (2026),Sen. Eliot Bostar,Nonpartisan unicameral,Not enacted separately; referred to Natural Resources Committee,Proposed the Large Load Customer Regulation Act for customers seeking more than 20 MW at a single site. Substantially similar large-load provisions appear in enacted LB1010.,Medium
